{
    "schemaVersion": "2.0.0",
    "contractName": "IERC1155Receiver",
    "compilerOutput": {
        "abi": [
            {
                "constant": false,
                "inputs": [
                    {
                        "name": "operator",
                        "type": "address"
                    },
                    {
                        "name": "from",
                        "type": "address"
                    },
                    {
                        "name": "ids",
                        "type": "uint256[]"
                    },
                    {
                        "name": "values",
                        "type": "uint256[]"
                    },
                    {
                        "name": "data",
                        "type": "bytes"
                    }
                ],
                "name": "onERC1155BatchReceived",
                "outputs": [
                    {
                        "name": "",
                        "type": "bytes4"
                    }
                ],
                "payable": false,
                "stateMutability": "nonpayable",
                "type": "function"
            },
            {
                "constant": false,
                "inputs": [
                    {
                        "name": "operator",
                        "type": "address"
                    },
                    {
                        "name": "from",
                        "type": "address"
                    },
                    {
                        "name": "id",
                        "type": "uint256"
                    },
                    {
                        "name": "value",
                        "type": "uint256"
                    },
                    {
                        "name": "data",
                        "type": "bytes"
                    }
                ],
                "name": "onERC1155Received",
                "outputs": [
                    {
                        "name": "",
                        "type": "bytes4"
                    }
                ],
                "payable": false,
                "stateMutability": "nonpayable",
                "type": "function"
            }
        ],
        "devdoc": {
            "methods": {
                "onERC1155BatchReceived(address,address,uint256[],uint256[],bytes)": {
                    "details": "The smart contract calls this function on the recipient after a `safeTransferFrom`. This function MAY throw to revert and reject the transfer. Return of other than the magic value MUST result in the transaction being reverted Note: the contract address is always the message sender",
                    "params": {
                        "data": "Additional data with no specified format",
                        "from": "The address which previously owned the token",
                        "ids": "An array containing ids of each token being transferred",
                        "operator": "The address which called `safeTransferFrom` function",
                        "values": "An array containing amounts of each token being transferred"
                    },
                    "return": "`bytes4(keccak256(\"onERC1155Received(address,address,uint256,uint256,bytes)\"))`"
                },
                "onERC1155Received(address,address,uint256,uint256,bytes)": {
                    "details": "The smart contract calls this function on the recipient after a `safeTransferFrom`. This function MAY throw to revert and reject the transfer. Return of other than the magic value MUST result in the transaction being reverted Note: the contract address is always the message sender",
                    "params": {
                        "data": "Additional data with no specified format",
                        "from": "The address which previously owned the token",
                        "id": "An array containing the ids of the token being transferred",
                        "operator": "The address which called `safeTransferFrom` function",
                        "value": "An array containing the amount of tokens being transferred"
                    },
                    "return": "`bytes4(keccak256(\"onERC1155Received(address,address,uint256,uint256,bytes)\"))`"
                }
            }
        },
        "evm": {
            "bytecode": {
                "linkReferences": {},
                "object": "0x",
                "opcodes": "",
                "sourceMap": ""
            },
            "deployedBytecode": {
                "linkReferences": {},
                "object": "0x",
                "opcodes": "",
                "sourceMap": ""
            }
        }
    },
    "sources": {
        "src/interfaces/IERC1155Receiver.sol": {
            "id": 5
        }
    },
    "sourceCodes": {
        "src/interfaces/IERC1155Receiver.sol": "/*\n\n  Copyright 2018 ZeroEx Intl.\n\n  Licensed under the Apache License, Version 2.0 (the \"License\");\n  you may not use this file except in compliance with the License.\n  You may obtain a copy of the License at\n\n    http://www.apache.org/licenses/LICENSE-2.0\n\n  Unless required by applicable law or agreed to in writing, software\n  distributed under the License is distributed on an \"AS IS\" BASIS,\n  WITHOUT WARRANTIES OR CONDITIONS OF ANY KIND, either express or implied.\n  See the License for the specific language governing permissions and\n  limitations under the License.\n\n*/\n\npragma solidity ^0.5.5;\n\n\ninterface IERC1155Receiver {\n    \n    /// @notice Handle the receipt of a single ERC1155 token type\n    /// @dev The smart contract calls this function on the recipient\n    /// after a `safeTransferFrom`. This function MAY throw to revert and reject the\n    /// transfer. Return of other than the magic value MUST result in the\n    ///transaction being reverted\n    /// Note: the contract address is always the message sender\n    /// @param operator  The address which called `safeTransferFrom` function\n    /// @param from      The address which previously owned the token\n    /// @param id        An array containing the ids of the token being transferred\n    /// @param value     An array containing the amount of tokens being transferred\n    /// @param data      Additional data with no specified format\n    /// @return          `bytes4(keccak256(\"onERC1155Received(address,address,uint256,uint256,bytes)\"))`\n    function onERC1155Received(\n        address operator,\n        address from,\n        uint256 id,\n        uint256 value,\n        bytes calldata data\n    )\n        external\n        returns(bytes4);\n\n    /// @notice Handle the receipt of multiple ERC1155 token types\n    /// @dev The smart contract calls this function on the recipient\n    /// after a `safeTransferFrom`. This function MAY throw to revert and reject the\n    /// transfer. Return of other than the magic value MUST result in the\n    /// transaction being reverted\n    /// Note: the contract address is always the message sender\n    /// @param operator  The address which called `safeTransferFrom` function\n    /// @param from      The address which previously owned the token\n    /// @param ids       An array containing ids of each token being transferred\n    /// @param values    An array containing amounts of each token being transferred\n    /// @param data      Additional data with no specified format\n    /// @return           `bytes4(keccak256(\"onERC1155Received(address,address,uint256,uint256,bytes)\"))`\n    function onERC1155BatchReceived(\n        address operator,\n        address from,\n        uint256[] calldata ids,\n        uint256[] calldata values,\n        bytes calldata data\n    )\n        external\n        returns(bytes4);\n}\n"
    },
    "sourceTreeHashHex": "0x707075df583f3bda5d59aa64e382a32f390cdb167829fcc8694e809379a3d50e",
    "compiler": {
        "name": "solc",
        "version": "soljson-v0.5.10+commit.5a6ea5b1.js",
        "settings": {
            "optimizer": {
                "enabled": true,
                "runs": 1000000
            },
            "outputSelection": {
                "*": {
                    "*": [
                        "abi",
                        "devdoc",
                        "evm.bytecode.object",
                        "evm.bytecode.sourceMap",
                        "evm.deployedBytecode.object",
                        "evm.deployedBytecode.sourceMap"
                    ]
                }
            },
            "evmVersion": "constantinople",
            "remappings": [
                "@0x/contracts-utils=/Users/fabioberger/Documents/projects/0x_project/0x-monorepo-one/contracts/erc1155/node_modules/@0x/contracts-utils"
            ]
        }
    },
    "networks": {}
}
