{
	"schemaVersion": "2.0.0",
	"contractName": "ISignatureValidator",
	"compilerOutput": {
		"abi": [
			{
				"constant": false,
				"inputs": [
					{
						"name": "hash",
						"type": "bytes32"
					},
					{
						"name": "signerAddress",
						"type": "address"
					},
					{
						"name": "signature",
						"type": "bytes"
					}
				],
				"name": "preSign",
				"outputs": [],
				"payable": false,
				"stateMutability": "nonpayable",
				"type": "function"
			},
			{
				"constant": false,
				"inputs": [
					{
						"name": "validatorAddress",
						"type": "address"
					},
					{
						"name": "approval",
						"type": "bool"
					}
				],
				"name": "setSignatureValidatorApproval",
				"outputs": [],
				"payable": false,
				"stateMutability": "nonpayable",
				"type": "function"
			},
			{
				"constant": true,
				"inputs": [
					{
						"name": "hash",
						"type": "bytes32"
					},
					{
						"name": "signerAddress",
						"type": "address"
					},
					{
						"name": "signature",
						"type": "bytes"
					}
				],
				"name": "isValidSignature",
				"outputs": [
					{
						"name": "isValid",
						"type": "bool"
					}
				],
				"payable": false,
				"stateMutability": "view",
				"type": "function"
			}
		],
		"devdoc": {
			"methods": {
				"isValidSignature(bytes32,address,bytes)": {
					"details": "Verifies that a signature is valid.",
					"params": {
						"hash": "Message hash that is signed.",
						"signature": "Proof of signing.",
						"signerAddress": "Address of signer."
					},
					"return": "Validity of order signature."
				},
				"preSign(bytes32,address,bytes)": {
					"details": "Approves a hash on-chain using any valid signature type.      After presigning a hash, the preSign signature type will become valid for that hash and signer.",
					"params": {
						"signature": "Proof that the hash has been signed by signer.",
						"signerAddress": "Address that should have signed the given hash."
					}
				},
				"setSignatureValidatorApproval(address,bool)": {
					"details": "Approves/unnapproves a Validator contract to verify signatures on signer's behalf.",
					"params": {
						"approval": "Approval or disapproval of  Validator contract.",
						"validatorAddress": "Address of Validator contract."
					}
				}
			}
		},
		"evm": {
			"bytecode": {
				"linkReferences": {},
				"object": "0x",
				"opcodes": "",
				"sourceMap": ""
			},
			"deployedBytecode": {
				"linkReferences": {},
				"object": "0x",
				"opcodes": "",
				"sourceMap": ""
			}
		}
	},
	"sources": {
		"src/interfaces/ISignatureValidator.sol": {
			"id": 16
		}
	},
	"sourceCodes": {
		"src/interfaces/ISignatureValidator.sol": "/*\n\n  Copyright 2018 ZeroEx Intl.\n\n  Licensed under the Apache License, Version 2.0 (the \"License\");\n  you may not use this file except in compliance with the License.\n  You may obtain a copy of the License at\n\n    http://www.apache.org/licenses/LICENSE-2.0\n\n  Unless required by applicable law or agreed to in writing, software\n  distributed under the License is distributed on an \"AS IS\" BASIS,\n  WITHOUT WARRANTIES OR CONDITIONS OF ANY KIND, either express or implied.\n  See the License for the specific language governing permissions and\n  limitations under the License.\n\n*/\n\npragma solidity ^0.5.5;\n\n\ncontract ISignatureValidator {\n\n    /// @dev Approves a hash on-chain using any valid signature type.\n    ///      After presigning a hash, the preSign signature type will become valid for that hash and signer.\n    /// @param signerAddress Address that should have signed the given hash.\n    /// @param signature Proof that the hash has been signed by signer.\n    function preSign(\n        bytes32 hash,\n        address signerAddress,\n        bytes calldata signature\n    )\n        external;\n    \n    /// @dev Approves/unnapproves a Validator contract to verify signatures on signer's behalf.\n    /// @param validatorAddress Address of Validator contract.\n    /// @param approval Approval or disapproval of  Validator contract.\n    function setSignatureValidatorApproval(\n        address validatorAddress,\n        bool approval\n    )\n        external;\n\n    /// @dev Verifies that a signature is valid.\n    /// @param hash Message hash that is signed.\n    /// @param signerAddress Address of signer.\n    /// @param signature Proof of signing.\n    /// @return Validity of order signature.\n    function isValidSignature(\n        bytes32 hash,\n        address signerAddress,\n        bytes memory signature\n    )\n        public\n        view\n        returns (bool isValid);\n}\n"
	},
	"sourceTreeHashHex": "0x0c01a13ce4a2c3f0b22528b462f36326a197dbc3731db27a6d51c0080d8043ce",
	"compiler": {
		"name": "solc",
		"version": "soljson-v0.5.10+commit.5a6ea5b1.js",
		"settings": {
			"optimizer": {
				"enabled": true,
				"runs": 1000000,
				"details": {
					"yul": true,
					"deduplicate": true,
					"cse": true,
					"constantOptimizer": true
				}
			},
			"outputSelection": {
				"*": {
					"*": [
						"abi",
						"devdoc",
						"evm.bytecode.object",
						"evm.bytecode.sourceMap",
						"evm.deployedBytecode.object",
						"evm.deployedBytecode.sourceMap"
					]
				}
			},
			"evmVersion": "constantinople",
			"remappings": [
				"@0x/contracts-exchange-libs=/Users/fabioberger/Documents/projects/0x_project/0x-monorepo-one/contracts/exchange/node_modules/@0x/contracts-exchange-libs",
				"@0x/contracts-utils=/Users/fabioberger/Documents/projects/0x_project/0x-monorepo-one/contracts/exchange/node_modules/@0x/contracts-utils",
				"@0x/contracts-erc20=/Users/fabioberger/Documents/projects/0x_project/0x-monorepo-one/contracts/exchange/node_modules/@0x/contracts-erc20"
			]
		}
	},
	"networks": {}
}